{
  "schema": "raf.human-ai.middleware.v1",
  "request_id": "HAM-20260722-POC001",
  "created_at": "2026-07-22T12:00:00Z",
  "intent": {
    "objective": "Indexar um segmento limitado de conversas localmente, sem exportar conteúdo bruto e sem ampliar o escopo automaticamente.",
    "expected_usefulness_target": 0.94,
    "measured_usefulness": null,
    "scope": [
      "bounded-segment",
      "privacy-first",
      "local-runtime"
    ]
  },
  "people": {
    "requester_role": "DATA_SUBJECT",
    "affected_people": [
      {
        "category": "DATA_SUBJECT",
        "count": 1,
        "minor": false,
        "consent_required": true
      }
    ],
    "human_final_decision": true,
    "appeal_path": "RafGitTools local review and revocation screen"
  },
  "data_boundary": {
    "classification": "PRIVATE",
    "categories": [
      "CONVERSATION_TEXT"
    ],
    "minimized_fields": [
      "unit_id",
      "content_hash",
      "redacted_text",
      "evidence_state"
    ],
    "excluded_fields": [
      "access_token",
      "refresh_token",
      "password",
      "secret",
      "api_key",
      "private_key",
      "authorization_header",
      "cookie",
      "session_token",
      "precise_location"
    ],
    "retention_seconds": 86400,
    "destination_visibility": "LOCAL_ONLY",
    "raw_data_export": false
  },
  "risk": {
    "level": "MEDIUM",
    "privacy": "HIGH",
    "security": "MEDIUM",
    "rights": "MEDIUM",
    "uncertainty": "TOKEN_VAZIO"
  },
  "ai_lane": {
    "duties": [
      "IDENTIFY_RISK",
      "MINIMIZE_DATA",
      "EXPLAIN_LIMITS",
      "PRESERVE_PROVENANCE",
      "ABSTAIN_WHEN_UNCERTAIN"
    ],
    "may_finalize": false,
    "may_expand_scope": false,
    "may_execute": false
  },
  "human_lane": {
    "consent_state": "APPROVED",
    "decision": "APPROVE_BOUNDED",
    "reviewers": [
      "OPERATOR",
      "PRIVACY_REVIEWER"
    ],
    "revocation_supported": true
  },
  "execution": {
    "target_repository": "rafaelmeloreisnovo/RafPolimata",
    "operation": "INDEX_BOUNDED_SEGMENT",
    "effect_class": "LOCAL_WRITE",
    "dry_run_first": true,
    "irreversible": false,
    "idempotency_key": "ham:20260722:poc001:index-segment",
    "limits": {
      "max_bytes": 10485760,
      "timeout_seconds": 300,
      "max_attempts": 2
    },
    "rollback": {
      "available": true,
      "strategy": "Delete only generated segment and receipt; preserve source unchanged."
    }
  },
  "evidence": {
    "F_ok": [
      "schema defined",
      "bounded limits defined",
      "human consent approved",
      "raw export disabled"
    ],
    "F_gap": [
      "device runtime has not executed the requested indexing job"
    ],
    "F_next": [
      "execute the bounded job and attach stdout stderr hashes and artifact digest"
    ],
    "state": "TOKEN_VAZIO",
    "claim_allowed": false,
    "refs": []
  },
  "friction": {
    "loop_budget": 2,
    "current_loop": 0,
    "stop_on_no_new_evidence": true,
    "token_vazio_reason": "Runtime evidence is still absent; do not repeat analysis without a new receipt."
  }
}
